item,itemLabel,page_title,gnis,website
http://www.wikidata.org/entity/Q5016481,Cadillac High School,Cadillac High School,,http://cadillac.chs.schooldesk.net/
http://www.wikidata.org/entity/Q5946889,Huron High School,"Huron High School (Ann Arbor, Michigan)",,http://www.a2huron.org
http://www.wikidata.org/entity/Q5053094,Catholic Central High School,"Catholic Central High School (Grand Rapids, Michigan)",,http://www.grcatholiccentral.com
http://www.wikidata.org/entity/Q5053096,Catholic Central High School,"Catholic Central High School (Manistee, Michigan)",,http://www.sabers.org
http://www.wikidata.org/entity/Q5637279,Hackett Catholic Central High School,Hackett Catholic Prep High School,,http://www.hackettcc.org
http://www.wikidata.org/entity/Q5417023,Everett High School,Everett High School (Michigan),,http://www.lansingschools.net/schools/high-schools/everett/
http://www.wikidata.org/entity/Q5015844,Cabrini High School,Cabrini High School (Michigan),,http://www.cabrinihighschool.org
http://www.wikidata.org/entity/Q5416948,Everest Academy and High School,Everest Collegiate High School and Academy,,http://www.everestcatholic.org/
http://www.wikidata.org/entity/Q5244519,De La Salle Collegiate High School,De La Salle Collegiate High School,,http://www.delasallehs.com
http://www.wikidata.org/entity/Q5647029,Hancock Central High School,Hancock Central High School (Michigan),,http://www.hancock.k12.mi.us/
http://www.wikidata.org/entity/Q5929087,Hudsonville High School,Hudsonville High School,,http://www.hudsonville.k12.mi.us/HPS/index.php?option=com_content&task=section&id=12&Itemid=136
http://www.wikidata.org/entity/Q5437597,Father Gabriel Richard High School,"Father Gabriel Richard High School (Ann Arbor, Michigan)",,http://www.fgrhs.org
http://www.wikidata.org/entity/Q5912952,Houghton High School,Houghton High School,,http://hpts.us/
http://www.wikidata.org/entity/Q5024077,Calumet High School,"Calumet High School (Calumet, Michigan)",,http://www.clkschools.org/high-school
http://www.wikidata.org/entity/Q4917555,Bishop Foley Catholic High School,Bishop Foley Catholic High School,,http://www.bishopfoley.org
http://www.wikidata.org/entity/Q6477225,Lake Orion High School,Lake Orion High School,,http://www.lakeorion.k12.mi.us/school_home.aspx?schoolid=1
http://www.wikidata.org/entity/Q5604690,Greenville High School,Greenville High School (Michigan),,http://www.greenville.k12.mi.us/HighSchool.cfm?subpage=76967
http://www.wikidata.org/entity/Q5249306,Deckerville High School,Deckerville High School,,
http://www.wikidata.org/entity/Q4894701,Berrien Springs High School,Berrien Springs High School,,
http://www.wikidata.org/entity/Q5188011,Croswell-Lexington High School,Croswell-Lexington High School,,
http://www.wikidata.org/entity/Q5178831,Cousino High School,Cousino High School,,http://www.wcs.k12.mi.us/cousino
http://www.wikidata.org/entity/Q5346142,Edwardsburg High School,Edwardsburg High School,,
http://www.wikidata.org/entity/Q4729429,All Saints Central High School,All Saints Central High School,,http://www.ascbaycity.org
http://www.wikidata.org/entity/Q5147866,Coloma High School,Coloma High School,,
http://www.wikidata.org/entity/Q4683257,Stevenson High School,"Adlai E. Stevenson High School (Livonia, Michigan)",,http://stevenson.livonia.k12.mi.us/index.html
http://www.wikidata.org/entity/Q4731997,Allendale High School,Allendale High School,,http://www.allendale.k12.mi.us/schools/highschool/
http://www.wikidata.org/entity/Q4887146,Bendle High School,Bendle High School,,
http://www.wikidata.org/entity/Q6470827,Ladywood High School,Ladywood High School,,http://www.ladywood.org
http://www.wikidata.org/entity/Q5265872,Detroit Catholic Central High School,Detroit Catholic Central High School,,http://www.catholiccentral.net
http://www.wikidata.org/entity/Q4712521,Albion High School,Albion High School (Michigan),,
http://www.wikidata.org/entity/Q5672123,Harry S. Truman High School,"Harry S. Truman High School (Taylor, Michigan)",,http://truman.taylorschools.net/
http://www.wikidata.org/entity/Q4916710,Birmingham Groves High School,Birmingham Groves High School,,
http://www.wikidata.org/entity/Q4683260,Adlai E. Stevenson High School,"Adlai E. Stevenson High School (Sterling Heights, Michigan)",,http://www.uticak12.org/schools/sc_stevenson.asp
http://www.wikidata.org/entity/Q5123218,City High-Middle School,City High-Middle School,,
http://www.wikidata.org/entity/Q5528852,Gaylord High School,Gaylord High School,,
http://www.wikidata.org/entity/Q4967663,Brighton High School,"Brighton High School (Brighton, Michigan)",,
http://www.wikidata.org/entity/Q5049147,Cass City High School,Cass City Jr./Sr. High School,,http://www.casscityschools.org/schools/jr-sr-high/
http://www.wikidata.org/entity/Q4733553,Alma High School,Alma High School (Michigan),,
http://www.wikidata.org/entity/Q5126181,Clare High School,Clare High School,,
http://www.wikidata.org/entity/Q5154774,Community High School,"Community High School (Ann Arbor, Michigan)",,
http://www.wikidata.org/entity/Q5173412,Corunna High School,Corunna High School,,
http://www.wikidata.org/entity/Q5330180,Eastern High School,Eastern High School (Michigan),,http://eastern.lansingschools.net
http://www.wikidata.org/entity/Q5157692,Comstock High School,Comstock High School,,
http://www.wikidata.org/entity/Q5148060,Colon High School,Colon High School,,
http://www.wikidata.org/entity/Q5184667,Crestwood High School,Crestwood High School (Michigan),,
http://www.wikidata.org/entity/Q5284076,Divine Child High School,Divine Child High School,,http://www.divinechildhighschool.org/
http://www.wikidata.org/entity/Q5468958,Forest Hills Eastern High School,Forest Hills Eastern High School,,
http://www.wikidata.org/entity/Q5246958,"Dearborn Center for Math, Science and Technology","Dearborn Center for Math, Science and Technology",,
http://www.wikidata.org/entity/Q4799078,Arthur Hill High School,Arthur Hill High School,,http://pub.spsd.net/arthurhill/index.html
http://www.wikidata.org/entity/Q4892180,Berkley High School,Berkley High School,,http://www.berkleyschools.org/bhs
http://www.wikidata.org/entity/Q5416078,Evart High School,Evart High School,,
http://www.wikidata.org/entity/Q5435896,Farmington High School,Farmington High School (Michigan),,
http://www.wikidata.org/entity/Q5468966,Forest Hills Northern High School,Forest Hills Northern High School,,http://www.fhps.net/northernhs
http://www.wikidata.org/entity/Q5459543,Flint Northwestern High School,Flint Northwestern High School,,
http://www.wikidata.org/entity/Q5594999,Grand Rapids Christian High School,Grand Rapids Christian High School,,
http://www.wikidata.org/entity/Q5610551,Grosse Pointe North High School,Grosse Pointe North High School,,http://gpschools.schoolwires.net/Domain/194
http://www.wikidata.org/entity/Q6107396,J. W. Sexton High School,J. W. Sexton High School,,https://www.edline.net/pages/JWSexton_HS
http://www.wikidata.org/entity/Q5149638,Columbia Central High School,"Columbia Central High School (Brooklyn, Michigan)",,http://www.myeagles.org/cchs/index.htm
http://www.wikidata.org/entity/Q5721400,Henry Ford Academy,Henry Ford Academy,,
http://www.wikidata.org/entity/Q5038575,Cardinal Mooney Catholic High School,"Cardinal Mooney Catholic High School (Marine City, Michigan)",,http://www.cardinalmooney.org
http://www.wikidata.org/entity/Q5687983,Hazel Park High School,Hazel Park High School,,
http://www.wikidata.org/entity/Q4829313,Avondale High School,Avondale High School (Michigan),,https://sites.google.com/a/avondaleschools.org/ahs/
http://www.wikidata.org/entity/Q5086000,Charlotte High School,Charlotte High School (Michigan),,http://www.charlottenet.org/charlotte_high_school.html
http://www.wikidata.org/entity/Q6032444,Ingham Academy High School,Ingham Academy High School (Michigan),,http://www.inghamisd.org/schools/inghamacademy/
http://www.wikidata.org/entity/Q4685101,Adrian High School,Adrian High School (Michigan),,http://www.theadrianmaples.com/our-schools-43/adrian-high-school-57.html
http://www.wikidata.org/entity/Q5435887,Farmington Central High School,Farmington Central High School (Michigan),,http://www.farmington.k12.mi.us/fcs/fchs/
http://www.wikidata.org/entity/Q6094508,Ithaca High School,Ithaca High School (Michigan),,
http://www.wikidata.org/entity/Q6391329,Kenowa Hills High School,Kenowa Hills High School,,
http://www.wikidata.org/entity/Q4993370,Lincoln High School,"Lincoln High School (Warren, Michigan)",,http://www.vdps.net/lhs
http://www.wikidata.org/entity/Q5654613,Harbor High School,Harbor High School (Michigan),,
http://www.wikidata.org/entity/Q4956896,Brandon High School,Brandon High School (Michigan),2649470,
http://www.wikidata.org/entity/Q4975554,Brother Rice High School,Brother Rice High School (Michigan),,http://www.brrice.edu
http://www.wikidata.org/entity/Q5328664,East Jackson High School,East Jackson Secondary School,,http://eastjacksonsecondaryschool.weebly.com/
http://www.wikidata.org/entity/Q5462914,Flushing High School,Flushing High School (Michigan),,http://www.flushingschools.org/HighSchool.cfm
http://www.wikidata.org/entity/Q6477746,Lake Shore High School,Lake Shore High School,,
http://www.wikidata.org/entity/Q1542881,St. Francis High School,"St. Francis High School (Traverse City, Michigan)",,
http://www.wikidata.org/entity/Q5649356,Hanover-Horton High School,Hanover-Horton High School,,http://www.hanoverhorton.org/vnews/display.v/SEC/Schools%7CHigh%20School
http://www.wikidata.org/entity/Q6232378,John F. Kennedy High School,"John F. Kennedy High School (Taylor, Michigan)",,
http://www.wikidata.org/entity/Q5468106,Fordson High School,Fordson High School,,http://fhs.dearbornschools.org/index.htm
http://www.wikidata.org/entity/Q5665660,Harrison High School,Harrison High School (Michigan),,http://www.farmington.k12.mi.us/hhs/
http://www.wikidata.org/entity/Q6235509,John Glenn High School,"John Glenn High School (Bangor Township, Michigan)",,
http://www.wikidata.org/entity/Q5328709,East Kentwood High School,East Kentwood High School,,http://www.kentwoodps.org/ourschools/eastkentwoodhighschool1012/
http://www.wikidata.org/entity/Q5515820,Gabriel Richard Catholic High School,Gabriel Richard Catholic High School,,http://www.gabrielrichard.org
http://www.wikidata.org/entity/Q6479030,Lakeshore High School,Lakeshore High School,,http://www.lakeshoreschools.k12.mi.us/high/
http://www.wikidata.org/entity/Q4731223,Allegan High School,Allegan High School,,http://www.alleganpublicschools.org/highschool/hshome.html
http://www.wikidata.org/entity/Q5734398,Herbert Henry Dow High School,Herbert Henry Dow High School,,https://dhs.midlandps.org
http://www.wikidata.org/entity/Q4731809,Allen Park High School,Allen Park High School,,http://www.apps.k12.mi.us
http://www.wikidata.org/entity/Q4883856,Belleville High School,Belleville High School (Michigan),,http://www.vanburenschools.net/Domain/8
http://www.wikidata.org/entity/Q5328806,East Lansing High School,East Lansing High School,,https://elps.us/our-schools/east-lansing-high-school/
http://www.wikidata.org/entity/Q4813495,Athens High School,"Athens High School (Troy, Michigan)",,http://athens.troy.k12.mi.us/
http://www.wikidata.org/entity/Q4681245,Addison Community Schools,Addison Community Schools,,http://addisonschools.org/
http://www.wikidata.org/entity/Q6693216,Lowell High School,Lowell High School (Michigan),,http://www.lowell.k12.mi.us/education/school/school.php?sectiondetailid=11368&backPath=L2VkdWNhdGlvbi9jb21wb25lbnRzL3NlYXJjaC9zZWFyY2gucGhwP3NlY3Rpb25kZXRhaWxpZD0xMTI0Ng==
http://www.wikidata.org/entity/Q6550738,Lincoln High School,"Lincoln High School (Ypsilanti, Michigan)",,http://www.lincoln.k12.mi.us/vnews/display.v/SEC/School%20Buildings%7CLincoln%20High%20School
http://www.wikidata.org/entity/Q6703185,Lumen Christi Catholic High School,Lumen Christi Catholic School,,http://jcslumenchristi.org/
http://www.wikidata.org/entity/Q6514439,Lee M. Thurston High School,Lee M. Thurston High School,,
http://www.wikidata.org/entity/Q6487446,Lansing Catholic High School,Lansing Catholic High School,,
http://www.wikidata.org/entity/Q6728004,Madison High School,Madison High School (Michigan),,
http://www.wikidata.org/entity/Q6552317,Linden High School,Linden High School (Michigan),,http://www.lindenschools.org/highschool.html
http://www.wikidata.org/entity/Q6488135,Lapeer East High School,Lapeer East High School,,http://east.lapeerschools.org/
http://www.wikidata.org/entity/Q6705711,Lutheran High School Westland,Lutheran High School Westland,,http://www.lhwl.lhsa.com/
http://www.wikidata.org/entity/Q6771776,Marlette High School,Marlette High School,,http://www.marlette.k12.mi.us/jrsr-high-school/
http://www.wikidata.org/entity/Q6775677,Martin High School,"Martin High School (Martin, Michigan)",,http://www.martinpublicschools.org/highschool/
http://www.wikidata.org/entity/Q7369191,Ross Beatty Junior/Senior High School,Ross Beatty Junior/Senior High School,,http://cassopolis.k12.mi.us/ross-beatty/
http://www.wikidata.org/entity/Q14716118,Grass Lake High School,Grass Lake High School,,http://glhs.grasslakeschools.com/?sessionid=cbbeb0afef28eb60a6ef6c36a5f6af2f&t
http://www.wikidata.org/entity/Q14716191,"Lincoln Park High School (Lincoln Park, Michigan)",Lincoln Park High School (Michigan),,http://lincolnparkpublicschools.com/web/?iduser=456&page=home
http://www.wikidata.org/entity/Q14716347,Western Michigan Christian High School,Western Michigan Christian High School,,http://www.wmchs.net/
http://www.wikidata.org/entity/Q7985909,West Michigan Lutheran High School,West Michigan Lutheran High School,,http://www.wmlhs.org
http://www.wikidata.org/entity/Q8059464,Ypsilanti High School,Ypsilanti High School,,http://wayback.archive.org/*/http://www.ypsd.org/schools/ypsihigh/index.html
http://www.wikidata.org/entity/Q7374619,Royal Oak High School,Royal Oak High School,,http://www.royaloakschools.com/portal/?q=rohs
http://www.wikidata.org/entity/Q22059618,Our Lady Star of the Sea High School,Our Lady Star of the Sea High School (Michigan),,https://starschoolgrossepointe.org
http://www.wikidata.org/entity/Q7440488,Seaholm High School,Seaholm High School,,http://seaholm.birmingham.k12.mi.us/?sessionid=8e3ca76e1994ff057c0345d50f34f605&t
http://www.wikidata.org/entity/Q25205215,Northeastern High School,Northeastern High School (Michigan),,
http://www.wikidata.org/entity/Q6781763,Marysville High School,"Marysville High School (Marysville, Michigan)",,http://www.marysville.k12.mi.us/1FUDDW4D
http://www.wikidata.org/entity/Q7590489,St. Mary High School,"St. Mary High School (Lake Leelanau, Michigan)",,http://www.stmarysll.org
http://www.wikidata.org/entity/Q14716225,"Midland High School (Midland, Michigan)","Midland High School (Midland, Michigan)",,http://midps.org/mhs
http://www.wikidata.org/entity/Q14716314,Vandercook Lake High School,Vandercook Lake High School,,http://www.vandyschools.org/webapp
http://www.wikidata.org/entity/Q7987915,Western High School,"Western High School (Parma, Michigan)",,
http://www.wikidata.org/entity/Q7591530,St. Philip Catholic Central High School,St. Philip Catholic Central High School,,http://bcacs.org/high-school.htm
http://www.wikidata.org/entity/Q7397102,Sacred Heart Academy High School,"Sacred Heart Academy High School (Mt. Pleasant, Michigan)",,http://www.sha.net
http://www.wikidata.org/entity/Q7974030,Waterford Kettering High School,Waterford Kettering High School,,http://www.waterford.k12.mi.us/pages/214/kettering
http://www.wikidata.org/entity/Q22059667,St. Agatha High School,St. Agatha High School (Michigan),,
http://www.wikidata.org/entity/Q22059727,St. Mary of Redford High School,St. Mary of Redford High School,,
http://www.wikidata.org/entity/Q7355242,Rockford High School,Rockford High School (Michigan),,
http://www.wikidata.org/entity/Q7590469,St. Mary Cathedral High School,St. Mary Cathedral High School (Michigan),,http://www.gaylordstmary.org
http://www.wikidata.org/entity/Q7846851,Troy High School,Troy High School (Michigan),,http://www.troycolts.org/
http://www.wikidata.org/entity/Q7984672,West Catholic High School,West Catholic High School,,http://grwestcatholic.org
http://www.wikidata.org/entity/Q7205811,Plymouth High School,Plymouth High School (Michigan),,http://pcep.pccs.k12.mi.us/
http://www.wikidata.org/entity/Q7308482,Regina High School,Regina High School (Michigan),,http://www.reginahs.com
http://www.wikidata.org/entity/Q14716126,Haslett High School,Haslett High School,,https://www.haslett.k12.mi.us/hhs
http://www.wikidata.org/entity/Q7629049,Sturgis High School,Sturgis High School,,http://www.sturgisps.org/hs/site/default.asp
http://www.wikidata.org/entity/Q22025532,St. Ambrose High School,"St. Ambrose High School (Grosse Pointe, Michigan)",,
http://www.wikidata.org/entity/Q14875208,International Academy of Macomb,International Academy of Macomb,,http://iamacomb.org/
http://www.wikidata.org/entity/Q7073670,Oak Park High School,Oak Park High School (Michigan),,http://www.oakparkschools.org/node/152
http://www.wikidata.org/entity/Q22059744,St. Paul High School,"St. Paul High School (Grosse Pointe Farms, Michigan)",,
http://www.wikidata.org/entity/Q22059684,St. Frederick High School,"St. Frederick High School (Pontiac, Michigan)",,
http://www.wikidata.org/entity/Q22059709,St. Ladislaus High School,St. Ladislaus High School,,
http://www.wikidata.org/entity/Q7885739,Union High School,"Union High School (Grand Rapids, Michigan)",,http://grpublicschools.org/unionhigh/
http://www.wikidata.org/entity/Q7363094,Romeo High School,Romeo High School,,http://romeo.k12.mi.us/pages/214/romeo-high-school
http://www.wikidata.org/entity/Q7353940,Rochester Adams High School,Rochester Adams High School,,http://www.rochester.k12.mi.us/pages/214/adams
http://www.wikidata.org/entity/Q7353983,Rochester High School,Rochester High School (Michigan),,http://www.rochester.k12.mi.us/rochester-high-school/pages/334/rochester-high-school-home-page
http://www.wikidata.org/entity/Q7996638,Whitmore Lake High School,Whitmore Lake Secondary School,,https://sites.google.com/a/wlps.net/high-school/
http://www.wikidata.org/entity/Q7974035,Waterford Mott High School,Waterford Mott High School,,http://www.waterford.k12.mi.us/pages/61/mott
http://www.wikidata.org/entity/Q6789627,Mattawan High School,Mattawan High School,,http://www.mattawanschools.org/hs
http://www.wikidata.org/entity/Q14716132,Henry Ford II High School,Henry Ford II High School,,
http://www.wikidata.org/entity/Q7504039,Shrine Catholic High School,Shrine Catholic High School,,http://www.shrineschools.com
http://www.wikidata.org/entity/Q7205752,Plymouth-Canton Educational Park,Plymouth-Canton Educational Park,,http://pcep.pccs.k12.mi.us/
http://www.wikidata.org/entity/Q23302639,DeWitt High School,DeWitt High School (Michigan),,
http://www.wikidata.org/entity/Q7063955,Nouvel Catholic Central High School,Nouvel Catholic Central High School,,http://www.sacschools.org/nouvel/home.aspx
http://www.wikidata.org/entity/Q7589327,St. Joseph High School,"St. Joseph High School (St. Joseph, Michigan)",,http://www.sjschools.org/site/default.aspx?domainid=97
http://www.wikidata.org/entity/Q6749921,Manistee High School,Manistee High School,,
http://www.wikidata.org/entity/Q8040339,Wyoming High School,Wyoming High School (Michigan),,http://www.wyoming.k12.mi.us/015/index.htm
http://www.wikidata.org/entity/Q14716184,Lake Michigan Catholic High School,Lake Michigan Catholic High School,,http://www.lmclakers.com
http://www.wikidata.org/entity/Q7056164,North Muskegon High School,North Muskegon High School,,
http://www.wikidata.org/entity/Q7231405,Portage Central High School,Portage Central High School,622990,
http://www.wikidata.org/entity/Q28147907,Bridgman High School,Bridgman High School,,
http://www.wikidata.org/entity/Q7179542,Pewamo-Westphalia Community Schools,Pewamo-Westphalia Community Schools,,https://www.pwschools.org/
http://www.wikidata.org/entity/Q7404689,Saline High School,Saline High School (Michigan),,http://www.salineschools.org/schools/saline-high-school/
http://www.wikidata.org/entity/Q6942754,Muskegon Catholic Central High School,Muskegon Catholic Central High School,,http://www.muskegoncatholic.org
http://www.wikidata.org/entity/Q7161599,Pellston High School,Pellston High School,,
http://www.wikidata.org/entity/Q19461005,Clarence M. Kimball High School,Clarence M. Kimball High School,,
http://www.wikidata.org/entity/Q7115351,Oxford High School,Oxford High School (Michigan),,http://www.oxfordschools.org/section_display.cfm?section_id=14
http://www.wikidata.org/entity/Q6772616,"Marquette Senior High School, Marquette, Michigan","Marquette Senior High School (Marquette, Michigan)",,
http://www.wikidata.org/entity/Q19771669,Buena Vista High School,Buena Vista High School (Michigan),,
http://www.wikidata.org/entity/Q6818747,Mercy High School,"Mercy High School (Farmington Hills, Michigan)",,
http://www.wikidata.org/entity/Q7111023,Our Lady of the Lakes High School,Our Lady of the Lakes Catholic School (Michigan),,
http://www.wikidata.org/entity/Q28230665,Harper Woods High School,Harper Woods High School,,
http://www.wikidata.org/entity/Q24040104,Pontiac Catholic High School,Pontiac Catholic High School,,
http://www.wikidata.org/entity/Q24040106,River Rouge Our Lady of Lourdes High School,"Our Lady of Lourdes High School (River Rouge, Michigan)",,
http://www.wikidata.org/entity/Q7055345,North Farmington High School,North Farmington High School,,
http://www.wikidata.org/entity/Q60745126,Otsego High School,Otsego High School (Michigan),,
http://www.wikidata.org/entity/Q7073992,Oakland Early College,Oakland Early College,,
http://www.wikidata.org/entity/Q19864988,Lake Linden–Hubbell High School,Lake Linden–Hubbell High School,,
http://www.wikidata.org/entity/Q7110914,Our Lady of Mount Carmel High School,"Our Lady of Mount Carmel High School (Wyandotte, Michigan)",,
http://www.wikidata.org/entity/Q6814114,Melvindale High School,Melvindale High School,,http://www.melnap.k12.mi.us/education/school/school.php?sectionid=4&
http://www.wikidata.org/entity/Q14716157,International Academy,International Academy,,http://www.iatoday.org/
http://www.wikidata.org/entity/Q14716313,Utica High School (Michigan),Utica High School (Michigan),,http://www.uticak12.org/schools/sc_utica.asp
http://www.wikidata.org/entity/Q7230697,Port Huron Northern High School,Port Huron Northern High School,,http://phn.phasd.us
http://www.wikidata.org/entity/Q7399268,Heritage High School,"Heritage High School (Saginaw, Michigan)",,http://saginaw.cyberschool.com/HHS/
http://www.wikidata.org/entity/Q7397217,Sacred Heart High School,"Sacred Heart High School (Roseville, Michigan)",,
http://www.wikidata.org/entity/Q7109187,Ottawa Hills High School,Ottawa Hills High School (Michigan),,
http://www.wikidata.org/entity/Q7970609,Warren Woods Tower High School,Warren Woods Tower High School,,
http://www.wikidata.org/entity/Q16998238,Kent Innovation High,Kent Innovation High,,http://studentvoice.kentisd.org/theschool/
http://www.wikidata.org/entity/Q7982926,Wenona Center High School,Wenona Center High School,,
http://www.wikidata.org/entity/Q7399270,Saginaw High School,Saginaw High School,,http://shs.spsd.net/
http://www.wikidata.org/entity/Q7236811,Powers Catholic High School,Powers Catholic High School,,http://www.powerscatholic.org/
http://www.wikidata.org/entity/Q12060444,Holt High School (Michigan),Holt High School (Michigan),,
http://www.wikidata.org/entity/Q6761901,Marian High School,Marian High School (Michigan),,http://www.marian-hs.org
http://www.wikidata.org/entity/Q7974557,Watervliet High School,"Watervliet High School (Watervliet, Michigan)",,http://www.watervlietps.org/domain/46
http://www.wikidata.org/entity/Q6965037,Napoleon High School,Napoleon High School (Michigan),,
http://www.wikidata.org/entity/Q14716343,Walled Lake Western High School,Walled Lake Western High School,,http://www.wlcsd.org/western.cfm
http://www.wikidata.org/entity/Q7591004,St. Patrick High School,"St. Patrick High School (Portland, Michigan)",,
http://www.wikidata.org/entity/Q7797754,Three Rivers High School,Three Rivers High School (Michigan),,http://www.trschools.org/ths/
