item,itemLabel,page_title,gnis,website
http://www.wikidata.org/entity/Q7059879,Northville High School,Northville High School,,
http://www.wikidata.org/entity/Q7060318,Northwestern High School,Northwestern High School (Michigan),,
http://www.wikidata.org/entity/Q7081932,Okemos High School,Okemos High School,,http://www.okemosschools.net/education/school/school.php?sectionid=14&linkid=nav-menu-container-1-57318
http://www.wikidata.org/entity/Q7073670,Oak Park High School,Oak Park High School (Michigan),,http://www.oakparkschools.org/node/152
http://www.wikidata.org/entity/Q7063462,Notre Dame Preparatory,"Notre Dame Preparatory (Pontiac, Michigan)",,http://www.ndpma.org
http://www.wikidata.org/entity/Q7073992,Oakland Early College,Oakland Early College,,
http://www.wikidata.org/entity/Q7064846,Novi High School,Novi High School,,
http://www.wikidata.org/entity/Q7063434,Notre Dame High School,"Notre Dame High School (Harper Woods, Michigan)",,http://www.ndpma.org/drupal/node/1158
http://www.wikidata.org/entity/Q7063955,Nouvel Catholic Central High School,Nouvel Catholic Central High School,,http://www.sacschools.org/nouvel/home.aspx
http://www.wikidata.org/entity/Q7156080,Paw Paw High School,Paw Paw High School (Michigan),,http://www.ppps.org/pphs
http://www.wikidata.org/entity/Q7109187,Ottawa Hills High School,Ottawa Hills High School (Michigan),,
http://www.wikidata.org/entity/Q7161599,Pellston High School,Pellston High School,,
http://www.wikidata.org/entity/Q7163420,Pennfield Senior High School,Pennfield Senior High School,,
http://www.wikidata.org/entity/Q7094567,Onsted High School,Onsted High School,,http://onsted.ohs.schoolfusion.us/
http://www.wikidata.org/entity/Q7170168,Pershing High School,Pershing High School,,http://icansoar.org/schools/high-school/pershing-high-school/
http://www.wikidata.org/entity/Q7115351,Oxford High School,Oxford High School (Michigan),,http://www.oxfordschools.org/section_display.cfm?section_id=14
http://www.wikidata.org/entity/Q7205800,Plymouth Educational Center,Plymouth Educational Center,,
http://www.wikidata.org/entity/Q7230695,Port Huron High School,Port Huron High School,,
http://www.wikidata.org/entity/Q7230697,Port Huron Northern High School,Port Huron Northern High School,,http://phn.phasd.us
http://www.wikidata.org/entity/Q7231949,Portland High School,Portland High School (Michigan),,
http://www.wikidata.org/entity/Q7231426,Portage Northern High School,Portage Northern High School,633687,
http://www.wikidata.org/entity/Q7205752,Plymouth-Canton Educational Park,Plymouth-Canton Educational Park,,http://pcep.pccs.k12.mi.us/
http://www.wikidata.org/entity/Q7200788,Plainwell High School,Plainwell High School,,
http://www.wikidata.org/entity/Q7205811,Plymouth High School,Plymouth High School (Michigan),,http://pcep.pccs.k12.mi.us/
http://www.wikidata.org/entity/Q7179542,Pewamo-Westphalia Community Schools,Pewamo-Westphalia Community Schools,,https://www.pwschools.org/
http://www.wikidata.org/entity/Q7355242,Rockford High School,Rockford High School (Michigan),,
http://www.wikidata.org/entity/Q7312420,Renaissance High School,Renaissance High School,,http://detroitk12.org/schools/renaissance/
http://www.wikidata.org/entity/Q7236811,Powers Catholic High School,Powers Catholic High School,,http://www.powerscatholic.org/
http://www.wikidata.org/entity/Q7338731,Riverview Community High School,Riverview Community High School,,http://www.riverviewschools.com/education/school/school.php?sectionid=11
http://www.wikidata.org/entity/Q7308482,Regina High School,Regina High School (Michigan),,http://www.reginahs.com
http://www.wikidata.org/entity/Q7353983,Rochester High School,Rochester High School (Michigan),,http://www.rochester.k12.mi.us/rochester-high-school/pages/334/rochester-high-school-home-page
http://www.wikidata.org/entity/Q7330438,Richfield Public School Academy,Richfield Public School Academy,,
http://www.wikidata.org/entity/Q7252404,Providence Christian School,Providence Christian School (Kalamazoo),,
http://www.wikidata.org/entity/Q15262587,Northwest High School (Michigan),Northwest High School (Michigan),,http://nwhs.nwschools.org/?sessionid=0e2ff36943a5b685d1b348a24754f481&t
http://www.wikidata.org/entity/Q15262584,"Northview High School (Grand Rapids, Michigan)",Northview High School (Michigan),,http://www.nvps.net/highschool/index.php?option=com_content&view=frontpage&Itemid=1
http://www.wikidata.org/entity/Q15232879,Kalamazoo Christian High School,Kalamazoo Christian High School,,
http://www.wikidata.org/entity/Q15253389,Milford High School (Michigan),Milford High School (Michigan),,http://www.hvs.org/schools/highschools/milford/
http://www.wikidata.org/entity/Q14875208,International Academy of Macomb,International Academy of Macomb,,http://iamacomb.org/
http://www.wikidata.org/entity/Q7363385,Romulus Senior High School,Romulus Senior High School,,
http://www.wikidata.org/entity/Q14716347,Western Michigan Christian High School,Western Michigan Christian High School,,http://www.wmchs.net/
http://www.wikidata.org/entity/Q7367577,Roscommon High School,Roscommon High School,,http://www.rapsk12.net/subsite/rhs
http://www.wikidata.org/entity/Q7363094,Romeo High School,Romeo High School,,http://romeo.k12.mi.us/pages/214/romeo-high-school
http://www.wikidata.org/entity/Q15218396,"Franklin High School (Livonia, Michigan)","Franklin High School (Livonia, Michigan)",,http://lpsfranklin.ss5.sharpschool.com
http://www.wikidata.org/entity/Q7397102,Sacred Heart Academy High School,"Sacred Heart Academy High School (Mt. Pleasant, Michigan)",,http://www.sha.net
http://www.wikidata.org/entity/Q7357608,Roeper School,Roeper School (Michigan),,http://www.roeper.org/
http://www.wikidata.org/entity/Q7369191,Ross Beatty Junior/Senior High School,Ross Beatty Junior/Senior High School,,http://cassopolis.k12.mi.us/ross-beatty/
http://www.wikidata.org/entity/Q15226536,Hudson High School (Michigan),Hudson High School (Michigan),,
http://www.wikidata.org/entity/Q7374619,Royal Oak High School,Royal Oak High School,,http://www.royaloakschools.com/portal/?q=rohs
http://www.wikidata.org/entity/Q15274438,Saint Johns High School,St Johns High School,,http://www.sjredwings.org/highschool/
http://www.wikidata.org/entity/Q16890420,Clintondale High School,Clintondale High School,,
http://www.wikidata.org/entity/Q16240936,Bloomfield Hills High School,Bloomfield Hills High School,,http://www.bloomfield.org/schools/bloomfield-hills-high-school/
http://www.wikidata.org/entity/Q16822090,Austin Catholic High School,Austin Catholic High School (Michigan),,http://austincatholicacademy.org
http://www.wikidata.org/entity/Q16966503,Eastpointe High School,Eastpointe High School,,http://www.eastpointeschools.org
http://www.wikidata.org/entity/Q16975073,Oakland University William Beaumont School of Medicine,Oakland University William Beaumont School of Medicine,,http://www.oakland.edu/medicine
http://www.wikidata.org/entity/Q20725458,University of Michigan Medical School,,,https://medicine.umich.edu/medschool/
http://www.wikidata.org/entity/Q29075482,Cranbrook Academy of Art,,,http://cranbrookart.edu/
http://www.wikidata.org/entity/Q7110835,Our Lady of LaSalette School,,,
http://www.wikidata.org/entity/Q17450167,Buell Elementary School,,,
http://www.wikidata.org/entity/Q53489323,American Immersion Theater,,,https://americanimmersion.theater
http://www.wikidata.org/entity/Q63117051,Detroit Museum of Art School,,,
http://www.wikidata.org/entity/Q65706491,Eagle Elementary School,,,
http://www.wikidata.org/entity/Q22059667,St. Agatha High School,St. Agatha High School (Michigan),,
http://www.wikidata.org/entity/Q22059676,St. Francis de Sales High School,"St. Francis de Sales High School (Detroit, Michigan)",,
http://www.wikidata.org/entity/Q22059684,St. Frederick High School,"St. Frederick High School (Pontiac, Michigan)",,
http://www.wikidata.org/entity/Q55633577,South Lake High School (Michigan),South Lake High School (Michigan),,https://slhs.solake.org/
