item,itemLabel,page_title,gnis,website
http://www.wikidata.org/entity/Q7590468,St. Mary Catholic Central High School,St. Mary Catholic Central High School,,http://www.smccmonroe.com
http://www.wikidata.org/entity/Q7590469,St. Mary Cathedral High School,St. Mary Cathedral High School (Michigan),,http://www.gaylordstmary.org
http://www.wikidata.org/entity/Q7611415,Sterling Heights High School,Sterling Heights High School,,
http://www.wikidata.org/entity/Q7589327,St. Joseph High School,"St. Joseph High School (St. Joseph, Michigan)",,http://www.sjschools.org/site/default.aspx?domainid=97
http://www.wikidata.org/entity/Q7591004,St. Patrick High School,"St. Patrick High School (Portland, Michigan)",,
http://www.wikidata.org/entity/Q7571416,Southwestern High School,Southwestern High School (Michigan),,http://detroitk12.org/schools/school/584/
http://www.wikidata.org/entity/Q7590391,St. Mary's Preparatory,St. Mary's Preparatory,,http://www.stmarysprep.com
http://www.wikidata.org/entity/Q7573825,Sparta High School,Sparta High School (Michigan),,
http://www.wikidata.org/entity/Q7619402,Stoney Creek High School,Stoney Creek High School,,http://www.rochester.k12.mi.us/pages/335/stoneycreek
http://www.wikidata.org/entity/Q7781997,Theodore Roosevelt High School,Theodore Roosevelt High School (Michigan),,
http://www.wikidata.org/entity/Q7743071,The Jean and Samuel Frankel Jewish Academy of Metropolitan Detroit,The Jean and Samuel Frankel Jewish Academy of Metropolitan Detroit,,http://www.frankelja.org
http://www.wikidata.org/entity/Q7692906,Tecumseh High School,Tecumseh High School (Michigan),,http://www.tps.k12.mi.us/ths/index.html
http://www.wikidata.org/entity/Q7629049,Sturgis High School,Sturgis High School,,http://www.sturgisps.org/hs/site/default.asp
http://www.wikidata.org/entity/Q7714383,The Art Institute of Michigan,The Art Institute of Michigan,,http://www.artinstitutes.edu/detroit/
http://www.wikidata.org/entity/Q7653528,Swan Valley High School,Swan Valley High School,,http://swanvalleyschools.com/highschool/
http://www.wikidata.org/entity/Q7894804,University Liggett School,University Liggett School,,http://www.uls.org
http://www.wikidata.org/entity/Q7836157,Traverse City West Senior High,Traverse City West Senior High School,,
http://www.wikidata.org/entity/Q7886882,Unionville-Sebewaing Area High School,Unionville-Sebewaing Area High School,,
http://www.wikidata.org/entity/Q7895335,University of Detroit Jesuit High School and Academy,University of Detroit Jesuit High School and Academy,,http://www.uofdjesuit.org/
http://www.wikidata.org/entity/Q7902780,"Utica Center for Math, Science, and Technology","Utica Center for Math, Science, and Technology",,http://www.macomb.k12.mi.us/utica/ucsmstc/
http://www.wikidata.org/entity/Q7885739,Union High School,"Union High School (Grand Rapids, Michigan)",,http://grpublicschools.org/unionhigh/
http://www.wikidata.org/entity/Q7838580,Trenton High School,Trenton High School (Michigan),,http://www.trenton.k12.mi.us/index.aspx?school=6
http://www.wikidata.org/entity/Q7846851,Troy High School,Troy High School (Michigan),,http://www.troycolts.org/
http://www.wikidata.org/entity/Q7912126,Valley Lutheran High School,Valley Lutheran High School (Michigan),,http://vlhs.com/
http://www.wikidata.org/entity/Q7963818,Walsh College of Accountancy and Business,Walsh College of Accountancy and Business,,http://www.walshcollege.edu
http://www.wikidata.org/entity/Q7963011,Walled Lake Central High School,Walled Lake Central High School,,
http://www.wikidata.org/entity/Q7963013,Walled Lake Northern High School,Walled Lake Northern High School,,
http://www.wikidata.org/entity/Q7974035,Waterford Mott High School,Waterford Mott High School,,http://www.waterford.k12.mi.us/pages/61/mott
http://www.wikidata.org/entity/Q7975494,Waverly Senior High School,Waverly Senior High School,,http://waverlyhighschool.net/
http://www.wikidata.org/entity/Q7970609,Warren Woods Tower High School,Warren Woods Tower High School,,
http://www.wikidata.org/entity/Q7974030,Waterford Kettering High School,Waterford Kettering High School,,http://www.waterford.k12.mi.us/pages/214/kettering
http://www.wikidata.org/entity/Q7972634,Washtenaw Technical Middle College,Washtenaw Technical Middle College,,http://www.themiddlecollege.org/
http://www.wikidata.org/entity/Q7974557,Watervliet High School,"Watervliet High School (Watervliet, Michigan)",,http://www.watervlietps.org/domain/46
http://www.wikidata.org/entity/Q7982926,Wenona Center High School,Wenona Center High School,,
http://www.wikidata.org/entity/Q7976468,Wayne Memorial High School,Wayne Memorial High School,,http://wayne.wwcsd.net/
http://www.wikidata.org/entity/Q7984485,West Bloomfield High School,West Bloomfield High School,,http://www.westbloomfield.k12.mi.us/wbhs/
http://www.wikidata.org/entity/Q7989880,Westwood High School,Westwood High School (Michigan),,
http://www.wikidata.org/entity/Q7985548,West Iron County High School,West Iron County High School,,
http://www.wikidata.org/entity/Q7987915,Western High School,"Western High School (Parma, Michigan)",,
http://www.wikidata.org/entity/Q7996638,Whitmore Lake High School,Whitmore Lake Secondary School,,https://sites.google.com/a/wlps.net/high-school/
http://www.wikidata.org/entity/Q7987971,Western International High School,Western International High School,,http://detroitk12.org/schools/western/
http://www.wikidata.org/entity/Q7984672,West Catholic High School,West Catholic High School,,http://grwestcatholic.org
http://www.wikidata.org/entity/Q7985909,West Michigan Lutheran High School,West Michigan Lutheran High School,,http://www.wmlhs.org
http://www.wikidata.org/entity/Q12060444,Holt High School (Michigan),Holt High School (Michigan),,
http://www.wikidata.org/entity/Q8040339,Wyoming High School,Wyoming High School (Michigan),,http://www.wyoming.k12.mi.us/015/index.htm
http://www.wikidata.org/entity/Q8032714,Woodhaven High School,Woodhaven High School,,
http://www.wikidata.org/entity/Q12204555,Michigan State University College of Human Medicine,Michigan State University College of Human Medicine,,http://www.chm.msu.edu/
http://www.wikidata.org/entity/Q8059464,Ypsilanti High School,Ypsilanti High School,,http://wayback.archive.org/*/http://www.ypsd.org/schools/ypsihigh/index.html
http://www.wikidata.org/entity/Q12060463,Holy Redeemer High School (Detroit),Holy Redeemer High School (Detroit),,
http://www.wikidata.org/entity/Q8026063,Winston Churchill High School,"Winston Churchill High School (Livonia, Michigan)",,http://lpschurchill.ss5.sharpschool.com
http://www.wikidata.org/entity/Q12204556,Michigan State University College of Osteopathic Medicine,Michigan State University College of Osteopathic Medicine,,http://www.com.msu.edu/
http://www.wikidata.org/entity/Q14716184,Lake Michigan Catholic High School,Lake Michigan Catholic High School,,http://www.lmclakers.com
http://www.wikidata.org/entity/Q14716118,Grass Lake High School,Grass Lake High School,,http://glhs.grasslakeschools.com/?sessionid=cbbeb0afef28eb60a6ef6c36a5f6af2f&t
http://www.wikidata.org/entity/Q14716191,"Lincoln Park High School (Lincoln Park, Michigan)",Lincoln Park High School (Michigan),,http://lincolnparkpublicschools.com/web/?iduser=456&page=home
http://www.wikidata.org/entity/Q14716219,Michigan Lutheran Seminary,Michigan Lutheran Seminary,,
http://www.wikidata.org/entity/Q14716157,International Academy,International Academy,,http://www.iatoday.org/
http://www.wikidata.org/entity/Q14716313,Utica High School (Michigan),Utica High School (Michigan),,http://www.uticak12.org/schools/sc_utica.asp
http://www.wikidata.org/entity/Q14716132,Henry Ford II High School,Henry Ford II High School,,
http://www.wikidata.org/entity/Q14716126,Haslett High School,Haslett High School,,https://www.haslett.k12.mi.us/hhs
http://www.wikidata.org/entity/Q14716225,"Midland High School (Midland, Michigan)","Midland High School (Midland, Michigan)",,http://midps.org/mhs
http://www.wikidata.org/entity/Q14716314,Vandercook Lake High School,Vandercook Lake High School,,http://www.vandyschools.org/webapp
http://www.wikidata.org/entity/Q14716202,Louhelen Bahá'í School,Louhelen Bahá'í School,,http://www.louhelen.org
http://www.wikidata.org/entity/Q14716272,Romeo Engineering and Technology Center,Romeo Engineering and Technology Center,,http://www.romeo.k12.mi.us/pages/50948/romeo-engineering-and-technology-center
http://www.wikidata.org/entity/Q14716343,Walled Lake Western High School,Walled Lake Western High School,,http://www.wlcsd.org/western.cfm
http://www.wikidata.org/entity/Q14716084,Defer Elementary School,Defer Elementary School,,
http://www.wikidata.org/entity/Q14716285,Southfield Christian School,Southfield Christian School,,
http://www.wikidata.org/entity/Q14716300,The Leelanau School,The Leelanau School,,
http://www.wikidata.org/entity/Q6935395,Mumford High School,Mumford High School,,http://detroitk12.org/schools/mumford/
http://www.wikidata.org/entity/Q6772616,"Marquette Senior High School, Marquette, Michigan","Marquette Senior High School (Marquette, Michigan)",,
http://www.wikidata.org/entity/Q6842372,Midland Montessori School,Midland Montessori School,,
http://www.wikidata.org/entity/Q6513886,Lee High School,"Lee High School (Wyoming, Michigan)",,
http://www.wikidata.org/entity/Q6728004,Madison High School,Madison High School (Michigan),,
http://www.wikidata.org/entity/Q7037017,Niles Community High School,Niles Community High School,,http://niles.troy.k12.mi.us/
http://www.wikidata.org/entity/Q6773619,Marshall High School,Marshall High School (Michigan),,http://www.marshall.k12.mi.us/MHS/index.php
http://www.wikidata.org/entity/Q6477746,Lake Shore High School,Lake Shore High School,,
http://www.wikidata.org/entity/Q7105759,Osborn High School,Osborn High School,,
http://www.wikidata.org/entity/Q7110914,Our Lady of Mount Carmel High School,"Our Lady of Mount Carmel High School (Wyandotte, Michigan)",,
http://www.wikidata.org/entity/Q7053604,NorthPointe Christian Schools,NorthPointe Christian Schools,,http://www.npchristian.org
http://www.wikidata.org/entity/Q7196697,Pioneer High School,"Pioneer High School (Ann Arbor, Michigan)",,http://www.a2schools.org/pioneer
http://www.wikidata.org/entity/Q7111023,Our Lady of the Lakes High School,Our Lady of the Lakes Catholic School (Michigan),,
http://www.wikidata.org/entity/Q7178490,Petoskey High School,Petoskey High School,,http://www.petoskeyschools.org/schools/high-school/
http://www.wikidata.org/entity/Q7305863,Redford High School,Redford High School,,
http://www.wikidata.org/entity/Q7231405,Portage Central High School,Portage Central High School,622990,
http://www.wikidata.org/entity/Q16983311,Western Michigan University Homer Stryker M.D. School of Medicine,Western Michigan University Homer Stryker M.D. School of Medicine,,http://med.wmich.edu/
http://www.wikidata.org/entity/Q7337927,River Valley High School,River Valley High School (Michigan),,
http://www.wikidata.org/entity/Q7353940,Rochester Adams High School,Rochester Adams High School,,http://www.rochester.k12.mi.us/pages/214/adams
http://www.wikidata.org/entity/Q7305868,Redford Union High School,Redford Union High School,,
http://www.wikidata.org/entity/Q16975397,Penny W. Stamps School of Art & Design,Penny W. Stamps School of Art & Design,,http://www.art-design.umich.edu
http://www.wikidata.org/entity/Q17514053,Jalen Rose Leadership Academy,Jalen Rose Leadership Academy,,
http://www.wikidata.org/entity/Q17012761,Oakland Christian School,Oakland Christian School,,http://www.oaklandchristian.com/
http://www.wikidata.org/entity/Q17033437,Warren Woods Christian School,Warren Woods Christian School,,
http://www.wikidata.org/entity/Q17513590,Caledonia High School,Caledonia High School (Michigan),,
http://www.wikidata.org/entity/Q17021615,St. Thomas More Academy,"St. Thomas More Academy (Burton, Michigan)",,http://www.stma-mi.org/
http://www.wikidata.org/entity/Q16997631,Japhet School,Japhet School,,http://www.japhetschool.org
http://www.wikidata.org/entity/Q17513142,Northville Christian School,Northville Christian School,,http://www.northvillechristianschool.org/
http://www.wikidata.org/entity/Q16993784,Franklin Road Christian School,Novi Christian Academy,,http://www.franklinroadchristianschool.org
http://www.wikidata.org/entity/Q17039986,Northern High School,"Northern High School (Detroit, Michigan)",,
http://www.wikidata.org/entity/Q16998238,Kent Innovation High,Kent Innovation High,,http://studentvoice.kentisd.org/theschool/
http://www.wikidata.org/entity/Q16995679,Holly Academy,Holly Academy,,
http://www.wikidata.org/entity/Q17033422,Warren Mott High School,Warren Mott High School,,
http://www.wikidata.org/entity/Q17021009,St. Catherine of Siena Academy,St. Catherine of Siena Academy,,http://www.saintcatherineacademy.org
http://www.wikidata.org/entity/Q17986450,Chippewa Valley High School,Chippewa Valley High School,,
http://www.wikidata.org/entity/Q19572965,McBain Rural Agricultural School,McBain Rural Agricultural School,,
http://www.wikidata.org/entity/Q20630715,Detroit International Academy for Young Women,Detroit International Academy for Young Women,,
http://www.wikidata.org/entity/Q19461005,Clarence M. Kimball High School,Clarence M. Kimball High School,,
http://www.wikidata.org/entity/Q19864988,Lake Linden–Hubbell High School,Lake Linden–Hubbell High School,,
http://www.wikidata.org/entity/Q20711254,Detroit East Catholic High School,Detroit East Catholic High School,,
http://www.wikidata.org/entity/Q18705955,Millington Jr./Sr. High School,Millington Jr./Sr. High School,,
http://www.wikidata.org/entity/Q18159068,Vicksburg High School,Vicksburg High School (Michigan),,http://www.vicksburgcommunityschools.org/high_school/
http://www.wikidata.org/entity/Q19768457,Saginaw Career Complex,Saginaw Career Complex,,http://saginawcareercomplex.com
http://www.wikidata.org/entity/Q19771683,Birch Run High School,Birch Run High School,,http://www.birchrun.k12.mi.us/District/Department/5-Birch-Run-High-School
http://www.wikidata.org/entity/Q20511467,AGBU Alex and Marie Manoogian School,AGBU Alex and Marie Manoogian School,,http://www.manoogian.org/
http://www.wikidata.org/entity/Q19771669,Buena Vista High School,Buena Vista High School (Michigan),,
http://www.wikidata.org/entity/Q21015949,Crockett High School,Crockett High School (Michigan),,
http://www.wikidata.org/entity/Q21015956,Detroit Waldorf School,Detroit Waldorf School,,
http://www.wikidata.org/entity/Q22021725,All Saints High School,"All Saints High School (Detroit, Michigan)",,
http://www.wikidata.org/entity/Q22022472,Felician Academy,"Felician Academy (Detroit, Michigan)",,
http://www.wikidata.org/entity/Q22021800,Austin Catholic Preparatory School,Austin Catholic Preparatory School,,
http://www.wikidata.org/entity/Q22022310,Davis Aerospace Technical High School,Davis Aerospace Technical High School,,
http://www.wikidata.org/entity/Q22033643,Cathedral High School,"Cathedral High School (Detroit, Michigan)",,
http://www.wikidata.org/entity/Q22033968,Dominican High School,Dominican High School (Detroit),,
http://www.wikidata.org/entity/Q22025532,St. Ambrose High School,"St. Ambrose High School (Grosse Pointe, Michigan)",,
http://www.wikidata.org/entity/Q22025533,St. Anne High School,"St. Anne High School (Warren, Michigan)",,
http://www.wikidata.org/entity/Q22033079,Annunciation High School,Annunciation High School (Detroit),,
http://www.wikidata.org/entity/Q22059561,Nativity High School,"Nativity High School (Detroit, Michigan)",,
http://www.wikidata.org/entity/Q22059651,Servite High School,Servite High School (Detroit),,
http://www.wikidata.org/entity/Q22059517,Immaculata High School,"Immaculata High School (Detroit, Michigan)",,
http://www.wikidata.org/entity/Q22059618,Our Lady Star of the Sea High School,Our Lady Star of the Sea High School (Michigan),,https://starschoolgrossepointe.org
http://www.wikidata.org/entity/Q22059642,Salesian High School,Salesian High School (Detroit),,
http://www.wikidata.org/entity/Q7797754,Three Rivers High School,Three Rivers High School (Michigan),,http://www.trschools.org/ths/
http://www.wikidata.org/entity/Q5687983,Hazel Park High School,Hazel Park High School,,
http://www.wikidata.org/entity/Q5135034,Clonlara School,Clonlara School,,
http://www.wikidata.org/entity/Q5721400,Henry Ford Academy,Henry Ford Academy,,
http://www.wikidata.org/entity/Q5721415,Henry Ford High School,"Henry Ford High School (Detroit, Michigan)",,
http://www.wikidata.org/entity/Q7799444,Thurston Elementary School,Thurston Elementary School,,http://www.a2schools.org/thurston.home/
http://www.wikidata.org/entity/Q5468966,Forest Hills Northern High School,Forest Hills Northern High School,,http://www.fhps.net/northernhs
http://www.wikidata.org/entity/Q56278521,Roseville High School,Roseville High School (Michigan),,
http://www.wikidata.org/entity/Q55634037,Stockbridge Junior / Senior High School,Stockbridge Junior / Senior High School,,http://panthernet.net/shs
http://www.wikidata.org/entity/Q66725666,Fruitport High School,Fruitport High School,,
http://www.wikidata.org/entity/Q55886526,L'Anse Creuse High School - North,L'Anse Creuse High School - North,,http://www.lc-ps.org/schools/hs/lchs-north/
http://www.wikidata.org/entity/Q60745126,Otsego High School,Otsego High School (Michigan),,
http://www.wikidata.org/entity/Q22059727,St. Mary of Redford High School,St. Mary of Redford High School,,
http://www.wikidata.org/entity/Q22059769,Sweetest Heart of Mary High School,"Sweetest Heart of Mary High School (Detroit, Michigan)",,
http://www.wikidata.org/entity/Q22059803,West Michigan Aviation Academy,West Michigan Aviation Academy,,http://www.westmichiganaviation.org/
http://www.wikidata.org/entity/Q22059761,St. Stanislaus High School,St. Stanislaus High School (Detroit),,
http://www.wikidata.org/entity/Q22059701,St. Joseph High School,"St. Joseph High School (Detroit, Michigan)",,
http://www.wikidata.org/entity/Q22059709,St. Ladislaus High School,St. Ladislaus High School,,
http://www.wikidata.org/entity/Q22059752,St. Rita High School,St. Rita High School (Detroit),,
http://www.wikidata.org/entity/Q22059744,St. Paul High School,"St. Paul High School (Grosse Pointe Farms, Michigan)",,
http://www.wikidata.org/entity/Q28147907,Bridgman High School,Bridgman High School,,
http://www.wikidata.org/entity/Q25205215,Northeastern High School,Northeastern High School (Michigan),,
http://www.wikidata.org/entity/Q23303035,Waterford Durant High School,Waterford Durant High School,,http://www.waterford.k12.mi.us/pages/219/durant
http://www.wikidata.org/entity/Q24062222,Detroit Leadership Academy,Detroit Leadership Academy,,
http://www.wikidata.org/entity/Q28147904,Baldwin Senior High School,Baldwin Senior High School (Michigan),,
http://www.wikidata.org/entity/Q24040104,Pontiac Catholic High School,Pontiac Catholic High School,,
http://www.wikidata.org/entity/Q24040106,River Rouge Our Lady of Lourdes High School,"Our Lady of Lourdes High School (River Rouge, Michigan)",,
http://www.wikidata.org/entity/Q24040229,Universal Academy,Universal Academy,,
http://www.wikidata.org/entity/Q24040230,Universal Learning Academy,Universal Learning Academy,,http://www.ulapsa.org/
http://www.wikidata.org/entity/Q23302639,DeWitt High School,DeWitt High School (Michigan),,
http://www.wikidata.org/entity/Q23302577,Arbor Preparatory High School,Arbor Preparatory High School,,http://www.Arborprep.com
http://www.wikidata.org/entity/Q25352016,St. Theresa of Avila High School,St. Theresa of Avila High School (Detroit),,
http://www.wikidata.org/entity/Q28230620,Bullock Creek High School,Bullock Creek High School,,http://www.bcreek.k12.mi.us/
http://www.wikidata.org/entity/Q28450440,Jeffers High School,Jeffers High School,,http://www.adams.k12.mi.us
http://www.wikidata.org/entity/Q28230665,Harper Woods High School,Harper Woods High School,,
http://www.wikidata.org/entity/Q38252024,Monroe High School,Monroe High School (Michigan),,
http://www.wikidata.org/entity/Q30609737,Beecher High School,Beecher High School (Michigan),,
http://www.wikidata.org/entity/Q51604408,Byron High School,"Byron High School (Byron, Michigan)",,https://www.byron.k12.mi.us/site/Default.aspx?PageID=84
http://www.wikidata.org/entity/Q55606070,Buchanan High School (Michigan),Buchanan High School (Michigan),,http://www.buchananschools.com/buchanan-high-school/
http://www.wikidata.org/entity/Q55608857,Dakota High School (Michigan),Dakota High School (Michigan),,http://www.chippewavalleyschools.org/schools/high-schools/dhs/
http://www.wikidata.org/entity/Q55605228,"Bentley High School (Burton, Michigan)","Bentley High School (Burton, Michigan)",,
http://www.wikidata.org/entity/Q6694418,Loy Norrix High School,Loy Norrix High School,,
http://www.wikidata.org/entity/Q6488135,Lapeer East High School,Lapeer East High School,,http://east.lapeerschools.org/
http://www.wikidata.org/entity/Q6479030,Lakeshore High School,Lakeshore High School,,http://www.lakeshoreschools.k12.mi.us/high/
http://www.wikidata.org/entity/Q6693216,Lowell High School,Lowell High School (Michigan),,http://www.lowell.k12.mi.us/education/school/school.php?sectiondetailid=11368&backPath=L2VkdWNhdGlvbi9jb21wb25lbnRzL3NlYXJjaC9zZWFyY2gucGhwP3NlY3Rpb25kZXRhaWxpZD0xMTI0Ng==
http://www.wikidata.org/entity/Q6552317,Linden High School,Linden High School (Michigan),,http://www.lindenschools.org/highschool.html
http://www.wikidata.org/entity/Q6550738,Lincoln High School,"Lincoln High School (Ypsilanti, Michigan)",,http://www.lincoln.k12.mi.us/vnews/display.v/SEC/School%20Buildings%7CLincoln%20High%20School
http://www.wikidata.org/entity/Q6487446,Lansing Catholic High School,Lansing Catholic High School,,
http://www.wikidata.org/entity/Q6479415,Lakewood High School,"Lakewood High School (Lake Odessa, Michigan)",,http://www.lakewoodps.org/index.php/schools/lakewood-high-school
http://www.wikidata.org/entity/Q6479251,Lakeview High School,"Lakeview High School (St. Clair Shores, Michigan)",,
http://www.wikidata.org/entity/Q6514439,Lee M. Thurston High School,Lee M. Thurston High School,,
http://www.wikidata.org/entity/Q6478812,Lakeland High School,Lakeland High School (Michigan),,http://www.huronvalley.k12.mi.us/schools/highschools/lakeland/
http://www.wikidata.org/entity/Q6724372,Mackenzie High School,Mackenzie High School (Michigan),,
http://www.wikidata.org/entity/Q6749921,Manistee High School,Manistee High School,,
http://www.wikidata.org/entity/Q6724800,Macomb Mathematics Science Technology Center,Macomb Mathematics Science Technology Center,,
http://www.wikidata.org/entity/Q6694565,Loyola High School,Loyola High School (Detroit),,http://www.loyolahsdetroit.org
http://www.wikidata.org/entity/Q6703185,Lumen Christi Catholic High School,Lumen Christi Catholic School,,http://jcslumenchristi.org/
http://www.wikidata.org/entity/Q6705711,Lutheran High School Westland,Lutheran High School Westland,,http://www.lhwl.lhsa.com/
http://www.wikidata.org/entity/Q6761901,Marian High School,Marian High School (Michigan),,http://www.marian-hs.org
http://www.wikidata.org/entity/Q6765261,Marion Junior-Senior High School,Marion Junior-Senior High School,,http://www.marion.k12.mi.us/schools/middle-high-school
http://www.wikidata.org/entity/Q6818747,Mercy High School,"Mercy High School (Farmington Hills, Michigan)",,
http://www.wikidata.org/entity/Q6775677,Martin High School,"Martin High School (Martin, Michigan)",,http://www.martinpublicschools.org/highschool/
http://www.wikidata.org/entity/Q6922910,Mount Pleasant High School,Mount Pleasant High School (Michigan),,http://mtpleasantschools.net/mphs
http://www.wikidata.org/entity/Q6837472,Michigan Center High School,Michigan Center Jr/Sr High School,,
http://www.wikidata.org/entity/Q6814114,Melvindale High School,Melvindale High School,,https://www.melnapschools.com/melvindale/
http://www.wikidata.org/entity/Q6920175,Mount Clemens High School,Mount Clemens High School,,
http://www.wikidata.org/entity/Q6776068,Martin Luther King High School,Martin Luther King High School (Detroit),,
http://www.wikidata.org/entity/Q6789627,Mattawan High School,Mattawan High School,,http://www.mattawanschools.org/hs
http://www.wikidata.org/entity/Q6771776,Marlette High School,Marlette High School,,http://www.marlette.k12.mi.us/jrsr-high-school/
http://www.wikidata.org/entity/Q6781763,Marysville High School,"Marysville High School (Marysville, Michigan)",,http://www.marysville.k12.mi.us/1FUDDW4D
http://www.wikidata.org/entity/Q6942754,Muskegon Catholic Central High School,Muskegon Catholic Central High School,,http://www.muskegoncatholic.org
http://www.wikidata.org/entity/Q6922925,Mount Pleasant Indian Industrial Boarding School,Mount Pleasant Indian Industrial Boarding School,,
http://www.wikidata.org/entity/Q6939093,Murray-Wright High School,Murray–Wright High School,,
http://www.wikidata.org/entity/Q6942758,Muskegon Heights High School,Muskegon Heights High School,,
http://www.wikidata.org/entity/Q7059473,Northglade Montessori Magnet School,Northglade Montessori Magnet School,,
http://www.wikidata.org/entity/Q7056164,North Muskegon High School,North Muskegon High School,,
http://www.wikidata.org/entity/Q7059631,Northport Public School,Northport Public School,,
http://www.wikidata.org/entity/Q7055345,North Farmington High School,North Farmington High School,,
http://www.wikidata.org/entity/Q6942759,Muskegon High School,Muskegon High School,,http://www.muskegonpublicschools.org/schools/muskegon/
http://www.wikidata.org/entity/Q7006727,New Covenant Christian School,"New Covenant Christian School (Lansing, Michigan)",,http://www.nccswarriors.org
http://www.wikidata.org/entity/Q6965037,Napoleon High School,Napoleon High School (Michigan),,
